{
  "documentKind": "canonical-feature-intent.v1",
  "featureId": "source-facts.cli-repository-projection",
  "featureFile": "features/cli-repository-projection-command.feature",
  "featureAnchor": "&feature:source-facts.cli-repository-projection",
  "purpose": "Persist and reconstruct the complete current governed repository using SQL as the only artifact-content source",
  "scenarios": [
    {
      "scenarioId": "source-facts.cli-repository-projection.load-current-image",
      "scenarioAnchor": "&scenario:source-facts.cli-repository-projection.load-current-image",
      "responsibilityId": "cli-current-repository-image-loading",
      "obligationId": "persist-every-governed-repository-artifact-exactly-once-in-current-root-state",
      "givenId": "governed-repository-working-tree-exists",
      "whenId": "load-repository-command-invoked",
      "thenId": "current-repository-image-is-persisted",
      "andId": "capture-does-not-admit-semantics",
      "implementationSymbols": [
        "runLoadRepository",
        "capturesRepositoryImage",
        "loadsRepositoryImageIntoSqlServer"
      ],
      "purpose": "User can replace one root's current database-backed repository image without creating historical source-file copies"
    },
    {
      "scenarioId": "source-facts.cli-repository-projection.extract-current-image",
      "scenarioAnchor": "&scenario:source-facts.cli-repository-projection.extract-current-image",
      "responsibilityId": "cli-current-repository-image-extraction",
      "obligationId": "reconstruct-complete-repository-from-durable-sql-content",
      "givenId": "current-repository-image-is-loaded",
      "whenId": "extract-repository-command-invoked",
      "thenId": "complete-repository-is-reconstructed",
      "andId": "projected-image-digest-agrees",
      "implementationSymbols": [
        "runExtractRepository",
        "extractsRepositoryImageFromSqlServer",
        "projectsRepositoryImageToWorkspace"
      ],
      "purpose": "User can reconstruct an exact complete workspace in an empty directory without reading the original repository"
    },
    {
      "scenarioId": "source-facts.cli-repository-projection.analyze-current-image",
      "scenarioAnchor": "&scenario:source-facts.cli-repository-projection.analyze-current-image",
      "responsibilityId": "cli-current-repository-semantic-analysis",
      "obligationId": "normalize-every-current-repository-artifact-with-explicit-coverage",
      "givenId": "complete-current-repository-image-is-in-sql",
      "whenId": "analyze-repository-command-invoked",
      "thenId": "typed-repository-knowledge-is-persisted",
      "andId": "every-artifact-has-semantic-coverage",
      "implementationSymbols": [
        "runAnalyzeRepository",
        "extractsRepositoryImageFromSqlServer",
        "projectsRepositorySemanticAnalysis",
        "loadsRepositorySemanticAnalysisIntoSqlServer"
      ],
      "purpose": "User can normalize current repository knowledge solely from database-backed artifact content with no silent coverage gaps"
    }
  ],
  "interfaceRoot": "src/cli.js#runLoadRepository",
  "lifecycle": "FEATURE_INTENT_PROPOSED",
  "authorityStatus": "FEATURE_AND_INTERFACE_AUTHORITY_MISSING",
  "createdAt": "2026-08-05T00:00:00Z"
}
