{
  "documentKind": "canonical-feature-intent.v1",
  "featureId": "source-facts.cli-canonical-test-closure",
  "featureFile": "features/cli-canonical-test-closure-command.feature",
  "featureAnchor": "&feature:source-facts.cli-canonical-test-closure",
  "purpose": "Relationally account for all repository tests as SQL-origin observations before canonical proof admission",
  "scenarios": [
    {
      "scenarioId": "source-facts.cli-canonical-test-closure.observe-from-sql-image",
      "scenarioAnchor": "&scenario:source-facts.cli-canonical-test-closure.observe-from-sql-image",
      "responsibilityId": "repository-test-knowledge-observation",
      "obligationId": "observe-complete-test-structure-without-admission",
      "givenId": "current-repository-image-and-intent-exist-in-sql",
      "whenId": "analyze-tests-command-invoked",
      "thenId": "test-structure-is-normalized-as-observation",
      "andId": "observations-are-not-auto-admitted",
      "implementationSymbols": ["runAnalyzeTests", "projectsRepositoryTestKnowledge", "loadsRepositoryTestKnowledgeIntoSqlServer"],
      "purpose": "Recover test structure and candidate lineage entirely from SQL repository bytes"
    },
    {
      "scenarioId": "source-facts.cli-canonical-test-closure.query-current-closure",
      "scenarioAnchor": "&scenario:source-facts.cli-canonical-test-closure.query-current-closure",
      "responsibilityId": "repository-test-closure-query",
      "obligationId": "return-truthful-current-test-closure",
      "givenId": "current-test-observation-is-sealed-in-sql",
      "whenId": "test-closure-command-invoked",
      "thenId": "scenario-proof-gaps-are-explicit",
      "andId": "no-proof-files-are-created",
      "implementationSymbols": ["runTestClosure", "queriesCurrentRepositoryTestClosure"],
      "purpose": "Expose scenario proof closure and unbound test posture through a bounded SQL query"
    },
    {
      "scenarioId": "source-facts.cli-canonical-test-closure.prove-one-vector",
      "scenarioAnchor": "&scenario:source-facts.cli-canonical-test-closure.prove-one-vector",
      "responsibilityId": "canonical-test-vector-execution",
      "obligationId": "prove-one-vector-with-independent-expectation-evaluation",
      "givenId": "admitted-test-vector-and-current-closure-seal-exist",
      "whenId": "prove-test-vector-command-invoked",
      "thenId": "observed-signal-is-compared-outside-execution-path",
      "andId": "execution-testimony-is-stored-only-in-sql",
      "implementationSymbols": ["runProveTestVector", "executesCanonicalTestVector", "recordsCanonicalTestExecutionInSqlServer"],
      "purpose": "Project an ephemeral Vitest embodiment, independently compare its observed signal, and store testimony in SQL"
    },
    {
      "scenarioId": "source-facts.cli-canonical-test-closure.query-test-meaning",
      "scenarioAnchor": "&scenario:source-facts.cli-canonical-test-closure.query-test-meaning",
      "responsibilityId": "repository-test-meaning-query",
      "obligationId": "every-observed-test-has-explicit-meaning-and-review-posture",
      "givenId": "current-test-meaning-recommendations-exist-in-sql",
      "whenId": "test-meaning-command-invoked",
      "thenId": "meaning-coverage-and-review-gaps-are-explicit",
      "andId": "recommendations-do-not-become-authority",
      "implementationSymbols": ["runTestMeaning", "queriesCurrentTestMeaningCoverage", "classifiesTestMeaning"],
      "purpose": "Expose complete evidence-backed test-meaning recommendations while preserving separate reviewed authority"
    }
  ],
  "interfaceRoot": "src/cli.js#runAnalyzeTests",
  "lifecycle": "FEATURE_INTENT_PROPOSED",
  "authorityStatus": "FEATURE_AND_INTERFACE_AUTHORITY_MISSING",
  "createdAt": "2026-08-05T00:00:00Z"
}
